{
  "$schema": "https://json-schema.org/draft/2020-12/schema",
  "$id": "https://portfolio.local/contracts/prediction-artifact/v1",
  "title": "PredictionArtifactV1",
  "type": "object",
  "required": ["schema_version", "producer", "created_at", "predictions"],
  "properties": {
    "schema_version": { "const": "1.0" },
    "producer": {
      "type": "object",
      "required": ["project", "version", "run_id"],
      "properties": {
        "project": { "type": "string", "minLength": 1 },
        "version": { "type": "string", "minLength": 1 },
        "run_id": { "type": "string", "minLength": 1 },
        "source_commit": { "type": "string", "minLength": 1 }
      },
      "additionalProperties": true
    },
    "created_at": { "type": "string", "format": "date-time" },
    "predictions": {
      "type": "array",
      "minItems": 1,
      "items": {
        "type": "object",
        "required": ["id", "prediction"],
        "properties": {
          "id": { "type": "string", "minLength": 1 },
          "prediction": { "type": "string" },
          "latency_ms": { "type": "number", "minimum": 0 },
          "context_ids": {
            "type": "array",
            "items": { "type": "string", "minLength": 1 }
          },
          "metadata": { "type": "object" }
        },
        "additionalProperties": true
      }
    }
  },
  "additionalProperties": false
}
